{
  "notebook": "FMA_2024",
  "year": 2024,
  "conference": "FMA",
  "sources_count": 118,
  "mind_map_title": "Flood Management and Research 2024",
  "main_themes": [
    {
      "id": "theme-1",
      "theme": "Infragravity Waves in Coastal Creeks",
      "description": "",
      "subtopics": [
        "Background",
        "Low Cost Gauges",
        "Observed Data Analysis",
        "Conclusions"
      ],
      "key_papers": []
    },
    {
      "id": "theme-2",
      "theme": "2023 DT01 Flood Damage Tool",
      "description": "",
      "subtopics": [
        "NSW Flood Guidance Changes",
        "Key Technical Changes",
        "Benchmarking and Case Studies"
      ],
      "key_papers": []
    },
    {
      "id": "theme-3",
      "theme": "Emergency Resources",
      "description": "",
      "subtopics": [
        "Red Cross Emergency Resources"
      ],
      "key_papers": []
    }
  ],
  "generated_date": "2026-04-18T11:57:41.251123Z",
  "notebooklm_url": "https://notebooklm.google.com/notebook/58b99d93-4101-4e11-93d6-a377158f5a18"
}